{
  "task_id": "bfe2e6ab-a67a-4fa3-a1ed-c7ae7e279475",
  "run_id": "5a5a4853-ca74-427f-89cf-14c1a91b7a3e",
  "reviewer_role": "reviewer",
  "verdict": "approved",
  "rubric_scores": {
    "doc_patch_safety": 1.0,
    "governance_applied": 1.0
  },
  "comments": "Automated reviewer verdict based on governance + hooks.",
  "requires_hotl": false
}